{
  "$schema": "https://json-schema.org/draft/2020-12/schema",
  "$id": "https://proper.local/schemas/proper_v2_3/qwen_model_inventory_freeze.schema.json",
  "type": "object",
  "additionalProperties": false,
  "required": ["schema_version","run_kind","checks","passed","remote_result_sha256","successful_manifest_sha256","successful_file_count","successful_total_bytes","preserved_preflight_failures","model_loaded","model_outputs_read","task_executed","gpu_used","acquisition_runtime_protocol_design_authorized","acquisition_runtime_freeze_authorized","real_branch_capture_authorized","model_runner_authorized","confirmatory_run_authorized","next_gate"],
  "properties": {
    "schema_version": {"const":1},
    "run_kind": {"const":"proper_v2_3_qwen_model_inventory_local_freeze"},
    "checks": {"type":"object","minProperties":1,"additionalProperties":{"type":"boolean"}},
    "passed": {"type":"boolean"},
    "remote_result_sha256": {"type":"object","minProperties":3,"additionalProperties":{"type":"string","pattern":"^[0-9a-f]{64}$"}},
    "successful_manifest_sha256": {"type":"string","pattern":"^[0-9a-f]{64}$"},
    "successful_file_count": {"type":"integer","minimum":1},
    "successful_total_bytes": {"type":"integer","minimum":1},
    "preserved_preflight_failures": {"const":2},
    "model_loaded": {"const":false},
    "model_outputs_read": {"const":false},
    "task_executed": {"const":false},
    "gpu_used": {"const":false},
    "acquisition_runtime_protocol_design_authorized": {"type":"boolean"},
    "acquisition_runtime_freeze_authorized": {"const":false},
    "real_branch_capture_authorized": {"const":false},
    "model_runner_authorized": {"const":false},
    "confirmatory_run_authorized": {"const":false},
    "next_gate": {"enum":["design_acquisition_runtime_protocol","stop_inventory_freeze"]}
  }
}
